{"effects":[{"id":"fx_01","params":{"intensity":0.6,"look":"warm_film"},"target_id":"clp_0002","type":"color_grade"}],"name":"Launch Week Recap (60s cut)","project_id":"proj_launch_week_recap","schema_version":"1.0","settings":{"aspect":"16:9","fps":30,"height":360,"sample_rate":48000,"time_unit":"seconds","width":640},"text_layers":[{"duration":2.4,"id":"txt_01","role":"title","start":0.3,"style":{"animation":"fade_up","color":"#FFFFFF","font":"Inter","position":"center","size":48},"text":"Launch Week Recap","track_id":"T1"}],"tracks":[{"clips":[{"asset_hash":"sha256:9ac0f3ffbaf97826fd95eb81d6e32742db79a7912a38dfaa4efebd9553c2f1fb","asset_label":"title_card","id":"clp_0001","lineage":{"created_by_op":"import","origin":"clp_0001","parent":null},"speed":1.0,"src_in":0.0,"src_out":3.0,"timeline_start":0.0,"volume":1.0},{"asset_hash":"sha256:4676d6d1855befc6582063ba3d0f648b03cbead2b9b5bce56e90d80d021f4d7d","asset_label":"a_cam","id":"clp_0002","lineage":{"created_by_op":"import","origin":"clp_0002","parent":null},"speed":1.0,"src_in":0.5,"src_out":6.5,"timeline_start":3.0,"volume":1.0},{"asset_hash":"sha256:6d5820b65526066a7a76f70f46d40942bcbbf5b0e7c469cc015356ef1b80b20c","asset_label":"b_cam","id":"clp_0003","lineage":{"created_by_op":"import","origin":"clp_0003","parent":null},"speed":1.0,"src_in":2.0,"src_out":7.0,"timeline_start":9.0,"volume":1.0},{"asset_hash":"sha256:4676d6d1855befc6582063ba3d0f648b03cbead2b9b5bce56e90d80d021f4d7d","asset_label":"a_cam","id":"clp_0004","lineage":{"created_by_op":"import","origin":"clp_0004","parent":null},"speed":1.0,"src_in":6.5,"src_out":11.5,"timeline_start":14.0,"volume":1.0},{"asset_hash":"sha256:cc376dd251bd8849e47dbd1e156b4284783ad1deea30ae162b8f2d1e4a283a74","asset_label":"broll_screen","id":"clp_0005","lineage":{"created_by_op":"import","origin":"clp_0005","parent":null},"speed":1.0,"src_in":0.0,"src_out":6.0,"timeline_start":19.0,"volume":1.0},{"asset_hash":"sha256:6d5820b65526066a7a76f70f46d40942bcbbf5b0e7c469cc015356ef1b80b20c","asset_label":"b_cam","id":"clp_0006","lineage":{"created_by_op":"import","origin":"clp_0006","parent":null},"speed":1.0,"src_in":7.0,"src_out":11.0,"timeline_start":25.0,"volume":1.0}],"id":"V1","kind":"video","name":"Main (A/B cam)"},{"clips":[{"asset_hash":"sha256:3ecd59cb633cee77dbf6dae6aacc8f74314e0d7d3933b6182eba3d55075f718d","asset_label":"broll_city","id":"clp_0007","lineage":{"created_by_op":"import","origin":"clp_0007","parent":null},"speed":1.0,"src_in":0.5,"src_out":3.5,"timeline_start":5.0,"volume":1.0},{"asset_hash":"sha256:7bbe70d12acba848fd1e81af7d45087c2067de2cf3be62db4289b47b41cad1ec","asset_label":"broll_product","id":"clp_0008","lineage":{"created_by_op":"import","origin":"clp_0008","parent":null},"speed":1.0,"src_in":1.0,"src_out":4.0,"timeline_start":15.5,"volume":1.0}],"id":"V2","kind":"video","name":"B-roll overlay"},{"clips":[],"id":"T1","kind":"text","name":"Titles & captions"},{"clips":[{"asset_hash":"sha256:a2c1983fa681a1b104bae27f8e9ec019be8d8f69c09350444ccfd0c8f4017b2e","asset_label":"music_upbeat","id":"clp_0009","lineage":{"created_by_op":"import","origin":"clp_0009","parent":null},"music_mood":"upbeat","speed":1.0,"src_in":0.0,"src_out":29.0,"timeline_start":0.0,"volume":0.8}],"id":"A1","kind":"audio","name":"Music"},{"clips":[{"asset_hash":"sha256:3e0f27d5f3fd44646119325f18c15096eb49d81582be0f97561715e925557086","asset_label":"sfx_whoosh","id":"clp_0010","lineage":{"created_by_op":"import","origin":"clp_0010","parent":null},"speed":1.0,"src_in":0.0,"src_out":0.8,"timeline_start":2.6,"volume":1.0}],"id":"A2","kind":"audio","name":"SFX"}],"transitions":[{"duration":0.5,"from_clip":"clp_0001","id":"tr_01","to_clip":"clp_0002","track_id":"V1","type":"crossfade"},{"duration":0.4,"from_clip":"clp_0003","id":"tr_02","to_clip":"clp_0004","track_id":"V1","type":"crossfade"},{"duration":0.5,"from_clip":"clp_0005","id":"tr_03","to_clip":"clp_0006","track_id":"V1","type":"dip_to_black"}]}