{"effects":[{"id":"fx_06","params":{"intensity":0.6,"look":"teal_orange"},"target_id":"clp_0004","type":"color_grade"}],"name":"Northwind video 01","project_id":"proj_ava_01","schema_version":"1.0","settings":{"aspect":"9:16","fps":30,"height":360,"sample_rate":48000,"time_unit":"seconds","width":640},"text_layers":[],"tracks":[{"clips":[{"asset_hash":"sha256:9ac0f3ffbaf97826fd95eb81d6e32742db79a7912a38dfaa4efebd9553c2f1fb","asset_label":"title_card","id":"clp_0001","lineage":{"created_by_op":"import","origin":"clp_0001","parent":null},"speed":1.0,"src_in":0.0,"src_out":3.0,"timeline_start":0.0,"volume":1.0},{"asset_hash":"sha256:6d5820b65526066a7a76f70f46d40942bcbbf5b0e7c469cc015356ef1b80b20c","asset_label":"b_cam","id":"clp_0002","lineage":{"created_by_op":"import","origin":"clp_0002","parent":null},"speed":1.0,"src_in":2.0,"src_out":2.853,"timeline_start":3.0,"volume":1.0},{"asset_hash":"sha256:6d5820b65526066a7a76f70f46d40942bcbbf5b0e7c469cc015356ef1b80b20c","asset_label":"b_cam","id":"clp_0003","lineage":{"created_by_op":"import","origin":"clp_0003","parent":null},"speed":1.0,"src_in":0.0,"src_out":3.696,"timeline_start":11.0,"volume":1.0},{"asset_hash":"sha256:3ecd59cb633cee77dbf6dae6aacc8f74314e0d7d3933b6182eba3d55075f718d","asset_label":"broll_city","id":"clp_0004","lineage":{"created_by_op":"import","origin":"clp_0004","parent":null},"speed":1.0,"src_in":0.0,"src_out":1.94,"timeline_start":19.0,"volume":1.0},{"asset_hash":"sha256:6d5820b65526066a7a76f70f46d40942bcbbf5b0e7c469cc015356ef1b80b20c","asset_label":"b_cam","id":"clp_0005","lineage":{"created_by_op":"import","origin":"clp_0005","parent":null},"speed":1.0,"src_in":0.0,"src_out":8.0,"timeline_start":25.0,"volume":1.0},{"asset_hash":"sha256:6d5820b65526066a7a76f70f46d40942bcbbf5b0e7c469cc015356ef1b80b20c","asset_label":"b_cam","id":"clp_0006","lineage":{"created_by_op":"import","origin":"clp_0006","parent":null},"speed":1.0,"src_in":0.0,"src_out":8.0,"timeline_start":33.0,"volume":1.0},{"asset_hash":"sha256:3ecd59cb633cee77dbf6dae6aacc8f74314e0d7d3933b6182eba3d55075f718d","asset_label":"broll_city","id":"clp_0007","lineage":{"created_by_op":"import","origin":"clp_0007","parent":null},"speed":1.0,"src_in":0.0,"src_out":6.0,"timeline_start":41.0,"volume":1.0},{"asset_hash":"sha256:6d5820b65526066a7a76f70f46d40942bcbbf5b0e7c469cc015356ef1b80b20c","asset_label":"b_cam","id":"clp_0008","lineage":{"created_by_op":"import","origin":"clp_0008","parent":null},"speed":1.0,"src_in":0.0,"src_out":8.0,"timeline_start":47.0,"volume":1.0}],"id":"V1","kind":"video","name":"Main"},{"clips":[],"id":"V2","kind":"video","name":"B-roll overlay"},{"clips":[],"id":"T1","kind":"text","name":"Titles & captions"},{"clips":[{"asset_hash":"sha256:a2c1983fa681a1b104bae27f8e9ec019be8d8f69c09350444ccfd0c8f4017b2e","asset_label":"music_upbeat","id":"clp_0028","lineage":{"created_by_op":"proj_ava_01/op_0082","origin":"clp_0028","parent":null},"music_mood":"upbeat","speed":1.0,"src_in":0.0,"src_out":8.0,"timeline_start":3.0,"volume":0.8}],"id":"A1","kind":"audio","name":"Music"}],"transitions":[{"duration":0.4,"from_clip":"clp_0001","id":"tr_15","to_clip":"clp_0002","track_id":"V1","type":"crossfade"},{"duration":0.4,"from_clip":"clp_0002","id":"tr_16","to_clip":"clp_0003","track_id":"V1","type":"hard_cut"},{"duration":0.4,"from_clip":"clp_0003","id":"tr_17","to_clip":"clp_0004","track_id":"V1","type":"crossfade"},{"duration":0.4,"from_clip":"clp_0004","id":"tr_18","to_clip":"clp_0005","track_id":"V1","type":"zoom_punch"},{"duration":0.4,"from_clip":"clp_0005","id":"tr_19","to_clip":"clp_0006","track_id":"V1","type":"zoom_punch"}]}